{
 "schema_version": 1,
 "job_id": "fdj-c3918bc2d04f72be",
 "base_version": 0,
 "producer": {
  "provider": "anthropic-claude-session",
  "model": "claude-opus-5-5",
  "mode": "manual_standin",
  "note": "Черновик написан сессией Claude по заданию в формате Qwen; живого канала к Qwen нет. Это не черновик Qwen.",
  "cost": null
 },
 "draft": {
  "title": "Творожная запеканка на желтках",
  "slug": "tvorozhnaya-zapekanka-na-zheltkah",
  "seo_title": "Творожная запеканка на желтках с манкой в духовке",
  "seo_description": "Запеканка из творога, желтков и манки, набухшей в молоке, с крахмалом. Выпекается 40 минут при 180 градусах, подаётся остывшей.",
  "intro": "Плотная и нежная запеканка, в которой работают только желтки: манка заранее набухает в молоке, крахмал помогает массе держать форму. После духовки запеканке нужно остыть — тогда она ровно режется.",
  "ingredients": [
   {
    "fact_index": 0,
    "display_name": "Творог"
   },
   {
    "fact_index": 1,
    "display_name": "Яичные желтки"
   },
   {
    "fact_index": 2,
    "display_name": "Манная крупа"
   },
   {
    "fact_index": 3,
    "display_name": "Молоко"
   },
   {
    "fact_index": 4,
    "display_name": "Сахар"
   },
   {
    "fact_index": 5,
    "display_name": "Крахмал"
   },
   {
    "fact_index": 6,
    "display_name": "Сливочное масло для формы"
   },
   {
    "fact_index": 7,
    "display_name": "Сахарная пудра для подачи"
   },
   {
    "fact_index": 8,
    "display_name": "Свежие ягоды для подачи"
   }
  ],
  "steps": [
   {
    "text": "Залейте манку молоком и дайте ей постоять 15 минут, чтобы крупа набухла.",
    "source_steps": [
     0
    ]
   },
   {
    "text": "Выложите творог в глубокую миску и тщательно разомните вилкой; приготовьте желтки.",
    "source_steps": [
     1,
     2,
     3
    ]
   },
   {
    "text": "Соедините творог с набухшей манкой и желтками и взбейте венчиком до однородности. Добавьте крахмал, сахар и щепотку соли.",
    "source_steps": [
     4,
     5
    ],
    "readiness_cue": "Масса гладкая, без творожных комочков."
   },
   {
    "text": "Смажьте форму сливочным маслом, переложите массу и выпекайте 40 минут при 180 градусах.",
    "source_steps": [
     6
    ],
    "readiness_cue": "Верх подрумянен, центр не колышется при покачивании формы."
   },
   {
    "text": "Оставьте запеканку остывать, затем украсьте ягодами и сахарной пудрой; можно добавить листики мяты.",
    "source_steps": [
     7,
     8,
     9
    ]
   }
  ],
  "tips": [
   {
    "text": "Тёплую запеканку не режут сразу: остывая, она становится плотнее и не крошится.",
    "verified": false
   }
  ],
  "substitutions": [
   {
    "from_index": 5,
    "to": "кукурузный крахмал",
    "note": "Если в рецепте имеется в виду картофельный, кукурузный даёт чуть более мягкую текстуру.",
    "verified": false
   }
  ],
  "editor_notes": [
   "Соль и мята упомянуты в шагах источника, но не в списке ингредиентов."
  ],
  "category": "zavtraki",
  "meal": "breakfast",
  "tags": [
   "tvorog",
   "v-duhovke"
  ]
 }
}
