{
 "schema_version": 1,
 "job_id": "fdj-9e2a8ec4fac6a36d",
 "base_version": 0,
 "producer": {
  "provider": "anthropic-claude-session",
  "model": "claude-opus-5-5",
  "mode": "manual_standin",
  "note": "Черновик написан сессией Claude по заданию в формате Qwen; живого канала к Qwen нет. Это не черновик Qwen.",
  "cost": null
 },
 "draft": {
  "title": "Салат с курицей, жареными грибами и яйцом",
  "slug": "salat-s-kuricej-gribami-i-yajcom",
  "seo_title": "Салат с курицей, шампиньонами, яйцом и айсбергом",
  "seo_description": "Салат из айсберга, огурца, курицы, яиц и обжаренных шампиньонов с заправкой из майонеза и дижонской горчицы.",
  "intro": "Сытный салат на обед: хрустящий айсберг и огурец, волокна готовой курицы, яйца и шампиньоны, обжаренные до испарения влаги. Заправка — майонез с горчицей.",
  "ingredients": [
   {
    "fact_index": 0,
    "display_name": "Куриная грудка (запечённая или отварная)"
   },
   {
    "fact_index": 1,
    "display_name": "Шампиньоны"
   },
   {
    "fact_index": 2,
    "display_name": "Куриные яйца"
   },
   {
    "fact_index": 3,
    "display_name": "Огурец"
   },
   {
    "fact_index": 4,
    "display_name": "Салат айсберг"
   },
   {
    "fact_index": 5,
    "display_name": "Майонез"
   },
   {
    "fact_index": 6,
    "display_name": "Чёрная соль"
   },
   {
    "fact_index": 7,
    "display_name": "Зелёный лук"
   },
   {
    "fact_index": 8,
    "display_name": "Дижонская горчица"
   },
   {
    "fact_index": 9,
    "display_name": "Оливковое масло"
   }
  ],
  "steps": [
   {
    "text": "Нарежьте айсберг не слишком мелко, огурец очистите и порежьте мелко, сложите их в глубокую миску.",
    "source_steps": [
     0,
     1
    ]
   },
   {
    "text": "Готовую курицу разберите на волокна, посолите и добавьте в миску.",
    "source_steps": [
     2,
     3
    ]
   },
   {
    "text": "Сварите яйца вкрутую, мелко порубите, посолите и тоже отправьте в салат.",
    "source_steps": [
     4,
     5
    ]
   },
   {
    "text": "Грибы порежьте крупно и отправьте в горячее масло. Держите большой огонь 2-3 минуты — за это время выпарится выделившийся сок.",
    "source_steps": [
     6
    ]
   },
   {
    "text": "Посолите, перемешайте и продолжайте жарить на среднем огне 5-6 минут, затем остудите.",
    "source_steps": [
     7
    ],
    "readiness_cue": "Грибы подрумянились и уменьшились в объёме."
   },
   {
    "text": "Добавьте грибы в салат, заправьте майонезом с горчицей, тщательно перемешайте и подавайте с зелёным луком.",
    "source_steps": [
     8,
     9
    ]
   }
  ],
  "tips": [
   {
    "text": "Тёплые грибы сделают айсберг вялым — их добавляют полностью остывшими.",
    "verified": false
   }
  ],
  "substitutions": [
   {
    "from_index": 5,
    "to": "греческий йогурт",
    "note": "Заправка станет легче и кислее.",
    "verified": false
   }
  ],
  "category": "salaty",
  "meal": "lunch",
  "tags": [
   "kurica",
   "griby",
   "yajca"
  ],
  "editor_notes": []
 }
}
